{
  "contract_version": "2.1.0",
  "schema_version": "2.0",
  "generated_at": "2026-09-22T00:00:00Z",
  "origem_csv": null,
  "stats": {
    "nata": 1,
    "candidatos_triagem": 0,
    "leads_total": 1,
    "sem_site": 1,
    "com_site": 0,
    "descartados": 0
  },
  "nata": [
    {
      "place_id": "PLACEID_SINTETICO_TRAVA01",
      "estagio_analise": "COMPLETO_SEM_SITE",
      "classe_site": "sem_site",
      "problema_vendavel": [],
      "identidade": {
        "nome": "Clinica Sintetica de Teste da Trava",
        "nicho": "Clínica de Fisioterapia",
        "cidade": "Alicante",
        "endereco": "1 Calle Ficticia",
        "google_maps_url": "https://www.google.com/maps?cid=1000000000000000001"
      },
      "contato": {
        "telefone": {
          "valor": "600000101",
          "estado": "CONFIRMADO_PRESENTE"
        },
        "email": {
          "valor": null,
          "estado": "CONFIRMADO_AUSENTE"
        },
        "instagram": {
          "valor": null,
          "estado": "CONFIRMADO_AUSENTE"
        },
        "facebook": {
          "valor": null,
          "estado": "CONFIRMADO_AUSENTE"
        },
        "linkedin": {
          "valor": null,
          "estado": "NAO_VERIFICADO"
        },
        "whatsapp_apto": true
      },
      "reputacao": {
        "nota_google": {
          "valor": 5.0,
          "estado": "CONFIRMADO_PRESENTE"
        },
        "review_count": {
          "valor": 107,
          "estado": "CONFIRMADO_PRESENTE"
        },
        "reputation_signal": "strong"
      },
      "presenca_digital": {
        "tem_site_proprio": {
          "valor": false,
          "estado": "CONFIRMADO_AUSENTE"
        },
        "website_url": {
          "valor": null,
          "estado": "CONFIRMADO_AUSENTE"
        },
        "site_via_rede_social": {
          "valor": null,
          "estado": "CONFIRMADO_AUSENTE"
        }
      },
      "gbp_diagnostico": {
        "score_completude": 40,
        "detail_scraped": true,
        "sinais": {
          "ficha_reivindicada": {
            "estado": "CONFIRMADO_PRESENTE"
          },
          "tem_horario": {
            "estado": "NAO_VERIFICADO"
          }
        },
        "lacunas": [
          "sem horário confirmado"
        ]
      },
      "gbp_campos_crus": {
        "ficha_reivindicada": {
          "valor": "YES",
          "estado": "CONFIRMADO_PRESENTE"
        },
        "tem_horario": {
          "valor": null,
          "estado": "NAO_VERIFICADO"
        },
        "tem_foto_destaque": {
          "valor": null,
          "estado": "NAO_VERIFICADO"
        },
        "tem_descricao": {
          "valor": null,
          "estado": "NAO_VERIFICADO"
        },
        "tem_faixa_preco": {
          "valor": null,
          "estado": "NAO_VERIFICADO"
        },
        "tem_plus_code": {
          "valor": null,
          "estado": "NAO_VERIFICADO"
        },
        "tem_dono_listado": {
          "valor": null,
          "estado": "NAO_VERIFICADO"
        },
        "detail_scraped": true
      },
      "evidencias_qualificador": {
        "fatos": [
          "107 avaliações no Google"
        ],
        "sinais_site": null
      },
      "priorizacao": {
        "autoritativo": false,
        "commercial_fit_score": 60,
        "priority": "alta",
        "contactability": "media",
        "risks": [
          "cidade não confirmada"
        ],
        "reasons": [
          "reputação: sinal 'strong' (+35)",
          "telefone disponível"
        ],
        "website_opportunity_score": null,
        "priority_score": null,
        "priority_label": null,
        "lacunas_interpretadas": null
      },
      "analise_tecnica_site": {
        "status": null,
        "error_type": null,
        "avaliado_em": null,
        "telefone_na_pagina": {
          "valor": null,
          "estado": "NAO_VERIFICADO"
        }
      },
      "psi": null
    }
  ],
  "candidatos_triagem": [],
  "descartados": []
}
